{
  "schema_version": "3.2",
  "database_version": "2026.08.11-v3.2-core",
  "last_reviewed": "2026-08-11",
  "policy": {
    "no_guessing": true,
    "dose_requires_source": true,
    "off_label_must_be_marked": true,
    "official_label_is_separate": true,
    "food_animal_withdrawal_requires_official_source": true
  },
  "drugs": [
    {
      "id": "amoxicillin-clavulanate",
      "generic_name_zh": "阿莫西林克拉维酸钾",
      "generic_name_en": "amoxicillin-clavulanate",
      "aliases": [],
      "brand_names": [],
      "active_ingredient": "阿莫西林克拉维酸钾",
      "pharmacologic_class": "β-内酰胺类/β-内酰胺酶抑制剂",
      "clinical_categories": [
        "抗菌",
        "皮肤",
        "呼吸道",
        "尿路",
        "口腔"
      ],
      "dosage_forms": [],
      "concentrations": [],
      "indications_general": [
        "抗菌",
        "皮肤",
        "呼吸道",
        "尿路",
        "口腔"
      ],
      "indication_keywords": [
        "抗菌",
        "皮肤",
        "呼吸道",
        "尿路",
        "口腔",
        "抗菌治疗",
        "皮肤治疗",
        "呼吸道治疗",
        "尿路治疗",
        "口腔治疗"
      ],
      "contraindications": [],
      "adverse_effects": [],
      "major_interactions": [],
      "special_warnings": [
        "剂量记录必须按物种、适应症、制剂浓度和来源逐条核验；未核验剂量不自动生成。"
      ],
      "pregnancy_lactation": "需按具体药物、物种及官方资料核验。",
      "records": [],
      "species_groups": [
        "犬",
        "猫"
      ],
      "search_terms": [
        "阿莫西林克拉维酸钾",
        "amoxicillin-clavulanate",
        "抗菌",
        "皮肤",
        "呼吸道",
        "尿路",
        "口腔"
      ],
      "last_verified": "2026-08-11",
      "review_status": "待核验"
    },
    {
      "id": "ampicillin",
      "generic_name_zh": "氨苄西林",
      "generic_name_en": "ampicillin",
      "aliases": [],
      "brand_names": [],
      "active_ingredient": "氨苄西林",
      "pharmacologic_class": "青霉素类",
      "clinical_categories": [
        "抗菌",
        "胃肠道",
        "呼吸道",
        "败血症"
      ],
      "dosage_forms": [],
      "concentrations": [],
      "indications_general": [
        "抗菌",
        "胃肠道",
        "呼吸道",
        "败血症"
      ],
      "indication_keywords": [
        "抗菌",
        "胃肠道",
        "呼吸道",
        "败血症",
        "抗菌治疗",
        "胃肠道治疗",
        "呼吸道治疗",
        "败血症治疗"
      ],
      "contraindications": [],
      "adverse_effects": [],
      "major_interactions": [],
      "special_warnings": [
        "剂量记录必须按物种、适应症、制剂浓度和来源逐条核验；未核验剂量不自动生成。"
      ],
      "pregnancy_lactation": "需按具体药物、物种及官方资料核验。",
      "records": [],
      "species_groups": [
        "犬",
        "猫",
        "经济动物"
      ],
      "search_terms": [
        "氨苄西林",
        "ampicillin",
        "抗菌",
        "胃肠道",
        "呼吸道",
        "败血症"
      ],
      "last_verified": "2026-08-11",
      "review_status": "待核验"
    },
    {
      "id": "cephalexin",
      "generic_name_zh": "头孢氨苄",
      "generic_name_en": "cephalexin",
      "aliases": [],
      "brand_names": [],
      "active_ingredient": "头孢氨苄",
      "pharmacologic_class": "第一代头孢菌素",
      "clinical_categories": [
        "抗菌",
        "皮肤",
        "尿路"
      ],
      "dosage_forms": [],
      "concentrations": [],
      "indications_general": [
        "抗菌",
        "皮肤",
        "尿路"
      ],
      "indication_keywords": [
        "抗菌",
        "皮肤",
        "尿路",
        "抗菌治疗",
        "皮肤治疗",
        "尿路治疗"
      ],
      "contraindications": [],
      "adverse_effects": [],
      "major_interactions": [],
      "special_warnings": [
        "剂量记录必须按物种、适应症、制剂浓度和来源逐条核验；未核验剂量不自动生成。"
      ],
      "pregnancy_lactation": "需按具体药物、物种及官方资料核验。",
      "records": [],
      "species_groups": [
        "犬",
        "猫"
      ],
      "search_terms": [
        "头孢氨苄",
        "cephalexin",
        "抗菌",
        "皮肤",
        "尿路"
      ],
      "last_verified": "2026-08-11",
      "review_status": "待核验"
    },
    {
      "id": "ceftiofur",
      "generic_name_zh": "头孢噻呋",
      "generic_name_en": "ceftiofur",
      "aliases": [],
      "brand_names": [],
      "active_ingredient": "头孢噻呋",
      "pharmacologic_class": "第三代头孢菌素",
      "clinical_categories": [
        "抗菌",
        "呼吸道",
        "乳房炎",
        "经济动物"
      ],
      "dosage_forms": [],
      "concentrations": [],
      "indications_general": [
        "抗菌",
        "呼吸道",
        "乳房炎",
        "经济动物"
      ],
      "indication_keywords": [
        "抗菌",
        "呼吸道",
        "乳房炎",
        "经济动物",
        "抗菌治疗",
        "呼吸道治疗",
        "乳房炎治疗",
        "经济动物治疗"
      ],
      "contraindications": [],
      "adverse_effects": [],
      "major_interactions": [],
      "special_warnings": [
        "剂量记录必须按物种、适应症、制剂浓度和来源逐条核验；未核验剂量不自动生成。"
      ],
      "pregnancy_lactation": "需按具体药物、物种及官方资料核验。",
      "records": [],
      "species_groups": [
        "经济动物"
      ],
      "search_terms": [
        "头孢噻呋",
        "ceftiofur",
        "抗菌",
        "呼吸道",
        "乳房炎",
        "经济动物"
      ],
      "last_verified": "2026-08-11",
      "review_status": "待核验"
    },
    {
      "id": "doxycycline",
      "generic_name_zh": "多西环素",
      "generic_name_en": "doxycycline",
      "aliases": [],
      "brand_names": [],
      "active_ingredient": "多西环素",
      "pharmacologic_class": "四环素类",
      "clinical_categories": [
        "抗菌",
        "呼吸道",
        "蜱媒",
        "立克次体",
        "支原体"
      ],
      "dosage_forms": [],
      "concentrations": [],
      "indications_general": [
        "抗菌",
        "呼吸道",
        "蜱媒",
        "立克次体",
        "支原体"
      ],
      "indication_keywords": [
        "抗菌",
        "呼吸道",
        "蜱媒",
        "立克次体",
        "支原体",
        "抗菌治疗",
        "呼吸道治疗",
        "蜱媒治疗",
        "立克次体治疗",
        "支原体治疗"
      ],
      "contraindications": [],
      "adverse_effects": [],
      "major_interactions": [],
      "special_warnings": [
        "剂量记录必须按物种、适应症、制剂浓度和来源逐条核验；未核验剂量不自动生成。"
      ],
      "pregnancy_lactation": "需按具体药物、物种及官方资料核验。",
      "records": [],
      "species_groups": [
        "犬",
        "猫",
        "鸟类"
      ],
      "search_terms": [
        "多西环素",
        "doxycycline",
        "抗菌",
        "呼吸道",
        "蜱媒",
        "立克次体",
        "支原体"
      ],
      "last_verified": "2026-08-11",
      "review_status": "待核验"
    },
    {
      "id": "metronidazole",
      "generic_name_zh": "甲硝唑",
      "generic_name_en": "metronidazole",
      "aliases": [],
      "brand_names": [],
      "active_ingredient": "甲硝唑",
      "pharmacologic_class": "硝基咪唑类",
      "clinical_categories": [
        "厌氧菌",
        "贾第虫",
        "胃肠道"
      ],
      "dosage_forms": [],
      "concentrations": [],
      "indications_general": [
        "厌氧菌",
        "贾第虫",
        "胃肠道"
      ],
      "indication_keywords": [
        "厌氧菌",
        "贾第虫",
        "胃肠道",
        "厌氧菌治疗",
        "贾第虫治疗",
        "胃肠道治疗"
      ],
      "contraindications": [],
      "adverse_effects": [],
      "major_interactions": [],
      "special_warnings": [
        "剂量记录必须按物种、适应症、制剂浓度和来源逐条核验；未核验剂量不自动生成。"
      ],
      "pregnancy_lactation": "需按具体药物、物种及官方资料核验。",
      "records": [],
      "species_groups": [
        "犬",
        "猫"
      ],
      "search_terms": [
        "甲硝唑",
        "metronidazole",
        "厌氧菌",
        "贾第虫",
        "胃肠道"
      ],
      "last_verified": "2026-08-11",
      "review_status": "待核验"
    },
    {
      "id": "enrofloxacin",
      "generic_name_zh": "恩诺沙星",
      "generic_name_en": "enrofloxacin",
      "aliases": [],
      "brand_names": [],
      "active_ingredient": "恩诺沙星",
      "pharmacologic_class": "氟喹诺酮类",
      "clinical_categories": [
        "抗菌",
        "尿路",
        "呼吸道",
        "革兰阴性菌"
      ],
      "dosage_forms": [],
      "concentrations": [],
      "indications_general": [
        "抗菌",
        "尿路",
        "呼吸道",
        "革兰阴性菌"
      ],
      "indication_keywords": [
        "抗菌",
        "尿路",
        "呼吸道",
        "革兰阴性菌",
        "抗菌治疗",
        "尿路治疗",
        "呼吸道治疗",
        "革兰阴性菌治疗"
      ],
      "contraindications": [],
      "adverse_effects": [],
      "major_interactions": [],
      "special_warnings": [
        "剂量记录必须按物种、适应症、制剂浓度和来源逐条核验；未核验剂量不自动生成。"
      ],
      "pregnancy_lactation": "需按具体药物、物种及官方资料核验。",
      "records": [],
      "species_groups": [
        "犬",
        "猫",
        "经济动物",
        "鸟类"
      ],
      "search_terms": [
        "恩诺沙星",
        "enrofloxacin",
        "抗菌",
        "尿路",
        "呼吸道",
        "革兰阴性菌"
      ],
      "last_verified": "2026-08-11",
      "review_status": "待核验"
    },
    {
      "id": "marbofloxacin",
      "generic_name_zh": "马波沙星",
      "generic_name_en": "marbofloxacin",
      "aliases": [],
      "brand_names": [],
      "active_ingredient": "马波沙星",
      "pharmacologic_class": "氟喹诺酮类",
      "clinical_categories": [
        "抗菌",
        "皮肤",
        "尿路",
        "呼吸道"
      ],
      "dosage_forms": [],
      "concentrations": [],
      "indications_general": [
        "抗菌",
        "皮肤",
        "尿路",
        "呼吸道"
      ],
      "indication_keywords": [
        "抗菌",
        "皮肤",
        "尿路",
        "呼吸道",
        "抗菌治疗",
        "皮肤治疗",
        "尿路治疗",
        "呼吸道治疗"
      ],
      "contraindications": [],
      "adverse_effects": [],
      "major_interactions": [],
      "special_warnings": [
        "剂量记录必须按物种、适应症、制剂浓度和来源逐条核验；未核验剂量不自动生成。"
      ],
      "pregnancy_lactation": "需按具体药物、物种及官方资料核验。",
      "records": [],
      "species_groups": [
        "犬",
        "猫"
      ],
      "search_terms": [
        "马波沙星",
        "marbofloxacin",
        "抗菌",
        "皮肤",
        "尿路",
        "呼吸道"
      ],
      "last_verified": "2026-08-11",
      "review_status": "待核验"
    },
    {
      "id": "clindamycin",
      "generic_name_zh": "克林霉素",
      "generic_name_en": "clindamycin",
      "aliases": [],
      "brand_names": [],
      "active_ingredient": "克林霉素",
      "pharmacologic_class": "林可酰胺类",
      "clinical_categories": [
        "牙周",
        "骨感染",
        "厌氧菌",
        "弓形虫"
      ],
      "dosage_forms": [],